Product Name,Section,Price,Discount,Rating
Blubby Multi Clutcher ( Pack of 1 ),Accessories,213,78.68,0
Sonal Brown Plastic Storage Racks ( Pack of 1 ),Accessories,500,37.89,0
AUTOGROOMZ Windshield Only Double Clamp Car Mobile Holder - Black,Accessories,217,81.9,0
CRAYLUXE Accu Pressure Bead Back / Lumbar Support Single Black,Accessories,538,64.11,0
GEEO Accu Pressure Bead Back / Lumbar Support Single Black,Accessories,223,77.68,0
"Portronics Clamp M3 Adjustable Car Mobile Phone Holder Stand for Dashboard & Windshield, 360degree Rotational, Strong Suction Cup, Compatible with 4 to 6 inch Devices(Black)",Accessories,268,70.19,0
"delhideals Indian Flag for Car Dashboard, Office Table, Study Table & Drawing Table",Accessories,195,67.45,0
QitmirMKT NEW KEYCHAIN LIGHTER WITH HIGH POWER LIGHT Multicolor Multipurpose Car Cigarette Lighter ( Pack of 1 ),Accessories,238,76.18,0
"5 In 1 Multi Pin Universal Portable Adapter And Car Mobile Charging Cable For (iPhone,Type C and Micro USB)",Accessories,254,74.57,0
"GEEO Universal Car Steering Knob, Car Steering Wheel Knob, Steering Wheel Spinner Knob, 360° Rotation Booster (3R Original)",Accessories,331,66.87,0
"Aksmit Pack of -1 Car Gear Knob Protector Gear Shifter Cover for Anti-Scratch Car Gear Knob Cover and Dust Proof Nonslip Gear Cover for Car Universal Fit Silicon Car Gear Knob Stylish- Black, Silicone Rubber",Accessories,187,53.13,0
Vertical9 Car Mobile Charger 3_in_1 cable Multicolour,Accessories,240,78.16,0
Car Ashtrays Multi Color,Accessories,176,74.82,0
Aksmit Premium Metal Key Cover Compitable for Maruti Suzuki Ignis,Accessories,434,56.56,0
RONISH Neck Cushions Set of 2 Black,Accessories,160,67.94,0
Tender care Memory Foam Back / Lumbar Support Single Black,Accessories,350,76.65,0
Ezybe Self Adhesive Kichen Shelf Light Blue Plastic Storage Racks (Pack of 2),Accessories,173,82.68,0
Digital Car Dashboard Alarm Clock and Stopwatch With Flexible Stand,Accessories,180,54.89,0
"TANTRA Car Armrest Cover Cushion with 2 Storage Bags - Soft, Comfortable, Non-Slip Protector for Vehicle Center Console - Waterproof, Durable, and Stylish",Accessories,365,63.46,0
"TANTRA Car Armrest Cover Cushion with 2 Storage Bags - Soft, Comfortable, Non-Slip Protector for Vehicle Center Console - Waterproof, Durable, and Stylish",Accessories,365,63.46,0
Anshri White Plastic Kitchen Dispenser ( Pack of 2 ),Accessories,167,66.53,0
Blubby Multi Rubber Band ( Pack of 30 ),Accessories,135,83.1,0
mahek accessories for Headrest Black,Accessories,137,86.29,0
Aksmit 4 Pieces 12 LED DC 12V Multicolour Music Car Strip Atmosphere Lamp Light for Car Interior Under Dash Lighting Kit with Sound Active Function and Wireless Control,Accessories,338,51.65,0
JAGIRA DIVINE TOUCH Multicolor Plastic Storage Racks ( Pack of 1 ),Accessories,116,83.4,0
RONISH Steering Cover Leatherite,Accessories,395,60.46,0
"48Inch Ice Blue & Red DRL LED Brake with Side Turn Signal & Parking Indication Trunk,Boot,Dicky Light For Innova 2005-12",Accessories,388,61.16,0
Anshri White Plastic Storage Racks ( Pack of 4 ),Accessories,250,74.97,0
swanoll Light Grey Plastic Kitchen Trolleys ( Pack of 1 ),Accessories,326,53.36,0
AKSMIT Dashboard Fan Black,Accessories,586,26.66,0
AKSMIT Dashboard Fan Black,Accessories,508,27.32,0
12 LED Multicolor Music Controlled Sound Activated for Car Interior Atmosphere Light (Works with All Cars) Pack Of-1,Accessories,351,49.79,0
"Premium Car Seat Belt Cover - Comfort & Safety Enhancer - Adjustable, Soft, & Stylish - Universal Fit for All Vehicles",Accessories,278,72.17,0
4 Color 17 CM DRL Strip,Accessories,187,62.53,0
CarFrill Gear Knob Metallic for 5 Speed Gear,Accessories,588,41.14,0
Bhavyta Night Vision Visor Plastic Yellow,Accessories,441,55.86,0
"Masala Rangoli Box Dabba for Keeping Spices, Spice Box for Kitchen, Plastic Wooden Style Masala Box, Masala Container, Masala Dabba",Accessories,171,82.88,0
CarFrill Gear Knob Silicone for 5 Speed Gear,Accessories,288,63.95,0
"4pcs Universal Fit Magnetic Car Side Window Curtains, Foldable Car Window Privacy Curtains Sunshade Side Magnet Pleated - Removable - Keeps Cooler Screen for Baby (Car Curtain-Black)",Accessories,669,44.2,0
"Portronics Car Power 5 Car Charger with Dual USB Ports ,Black (POR 1345) wihtout cable",Accessories,204,59.12,0
Cozy Wear Black Men's Daily Slipper,Footwear,183,63.33,0
Xtoon Grey Men's Outdoor Shoes,Footwear,498,66.78,0
AROTEK Grey Men's Daily Slipper,Footwear,191,76.1,0
PENNEN Green Women's Flats,Footwear,270,66.21,0
Dream Makers - Black Women's Sandal Heels,Footwear,407,72.85,0
Cozy Wear Brown Men's Daily Slipper,Footwear,193,61.32,0
YOU LIkE Brown Men's Derby Formal Shoes,Footwear,693,80.19,0
FUSEOWL Maroon Women's Flip Flop,Footwear,171,82.88,0
PERY PAO Blue Men's Slide Flip Flop,Footwear,226,77.38,0
YNP Design Collections Brown Women's Ethnic Ballerinas,Footwear,411,17.64,0
ZYPSO Zypso Men’s Grey Synthetic Grey Men's Lifestyle Shoes,Footwear,559,72.04,0
Cozy Wear Olive Men's Daily Slipper,Footwear,193,61.32,0
hanuco Height Increasing Insoles,Footwear,301,69.87,0
Asian Black School Shoes for Boys,Footwear,245,38.6,0
BEE U NIK Black Men's Thong Flip Flop,Footwear,176,64.73,0
SHUAN Brown Men's Slip on,Footwear,510,73.14,0
Citipiti ind. Green Women's Flats,Footwear,208,70.24,0
Squash Black Men's Thong Flip Flop,Footwear,230,67.1,0
Z Brown Men's Slide Flip Flop,Footwear,279,65.08,0
Radhe Creation Cream Polish Suitable for Black Color,Footwear,197,67.11,0
lyvi Black Men's Daily Slipper,Footwear,187,79.2,0
Xtoon Multi Color Men's Korean Shoes,Footwear,548,63.44,0
Cozy Wear Black Men's Daily Slipper,Footwear,214,57.11,0
PENNEN Blue Women's Flats,Footwear,270,66.21,0
Dream Makers - Black Women's Sandal Heels,Footwear,407,72.85,0
LiteHawks Green Men's Daily Slipper,Footwear,220,77.98,0
Leeport - Brown Men's Slip On Formal Shoes,Footwear,610,75.59,0
FUSEOWL Light Grey Women's Toe Covered Flip Flop,Footwear,250,74.97,0
KARADDI Brown Women's Formal Ballerinas,Footwear,438,78.09,0
HANSWING All Type Shoes Cleaner,Footwear,148,81.48,0
Campus Oxyfit (N) Navy Blue Men's Slip-on Shoes,Footwear,622,37.74,0
BHAVYTA COSMETIC Cream Polish Suitable for White Color,Footwear,160,82.2,0
Densu Black Men's Korean Shoes,Footwear,597,60.17,0
ROGZI Cream Polish Suitable for Neutral Color,Footwear,181,9.05,0
PENNEN White Men's Lifestyle Shoes,Footwear,552,44.74,0
"ADISO Trendy ,outdoor stylish casual White Men's Outdoor Shoes",Footwear,597,80.09,0
MAAN Black Women's Gladiators Flats,Footwear,216,78.38,0
PENNEN White Men's Lifestyle Shoes,Footwear,393,60.66,0
Seafoot White Men's Outdoor Shoes,Footwear,317,68.27,0
hanuco Orthopaedic Insoles,Footwear,252,71.62,0
Cool and NIce kids Multi color Bermuda pack of 5,Kids Fashion,341,43.07,0
"A.W.A KIDS FASHION Cotton Frock For Girls ( Pack of 1 , Blue )",Kids Fashion,382,45.35,0
"A.W.A KIDS FASHION Cotton Blend Frock For Girls ( Pack of 1 , Pink )",Kids Fashion,382,61.76,0
"A.W.A KIDS FASHION Cotton Blend Frock For Girls ( Pack of 1 , Light Blue )",Kids Fashion,382,61.76,0
"Arshia Fashions Cotton Blend Shirt Dress For Girls ( Pack of 1 , Blue )",Kids Fashion,501,74.94,0
"Arshia Fashions Girls Cotton Blend Kurti with Sharara ( Pack of 1 , Pink )",Kids Fashion,561,83.97,0
"Villata fashion Net Frock For Girls ( Pack of 1 , White )",Kids Fashion,275,72.47,0
"Nios Fashion Girls Cotton Polyester Jeans ( Pack of 2 , Multicolor 4 )",Kids Fashion,355,60.51,0
"PMD Fashion Net Lehenga Choli Set For Girls ( Pack of 1 , Charcoal )",Kids Fashion,355,64.46,0
s muktar garments - Green Cotton Blend Boys Professional Costume ( Pack of 1 ),Kids Fashion,311,55.51,0
NI FASHION Pack of 1 Boys Cotton Blend T-Shirt ( Black ),Kids Fashion,171,65.73,0
"Arshia Fashions Polyester Shirt Dress For Girls ( Pack of 1 , Multicolor )",Kids Fashion,561,71.94,0
"Arshia Fashions Net Lehenga Choli Sets For Girls ( , Blue )",Kids Fashion,381,84.12,0
NAYPAL FASHION STYLE Pack of 1 Boys & Girls Cotton Blend T-Shirt ( Pink ),Kids Fashion,246,75.38,0
"Villata fashion Net Frock For Girls ( Pack of 1 , Red )",Kids Fashion,290,70.97,0
"Arshia Fashions Polyester Blend Frock For Girls ( Pack of 1 , Red )",Kids Fashion,321,78.59,0
KASEERA CUTE STYLISH AND TRENDING KIDS GYM VEST PACK OF 5,Kids Fashion,273,60.94,0
"A.W.A KIDS FASHION Cotton Blend Frock For Girls ( Pack of 1 , Red )",Kids Fashion,582,41.74,0
"Villata fashion Net Frock For Girls ( Pack of 1 , Red )",Kids Fashion,331,66.87,0
"Arshia Fashions Polyester Fit And Flare Dress For Girls ( Pack of 1 , Purple )",Kids Fashion,561,71.94,0
"Arshia Fashions Girls Cotton Blend Patiala Kurta Set ( Pack of 1 , Green )",Kids Fashion,561,77.55,0
"Villata fashion Net Frock For Girls ( Pack of 1 , White )",Kids Fashion,331,66.87,0
"Nios Fashion Girls Cotton Polyester Jeans ( Pack of 2 , Multicolor 1 )",Kids Fashion,355,60.51,0
NI FASHION Pack of 1 Boys Cotton Blend T-Shirt ( Green ),Kids Fashion,171,65.73,0
"A.W.A KIDS FASHION Cotton Blend Frock For Girls ( Pack of 1 , Green )",Kids Fashion,582,41.74,0
NI FASHION Pack of 1 Boys Cotton Blend T-Shirt ( Purple ),Kids Fashion,171,65.73,0
NI FASHION Pack of 1 Boys Cotton Blend T-Shirt ( Sky Blue ),Kids Fashion,171,65.73,0
"Villata fashion Net Frock For Girls ( Pack of 1 , Pink )",Kids Fashion,290,70.97,0
NI FASHION Pack of 1 Boys Cotton Blend T-Shirt ( Maroon ),Kids Fashion,171,65.73,0
"PMD Fashion Net Lehenga Choli Set For Girls ( Pack of 1 , Wine )",Kids Fashion,355,64.46,0
"Villata fashion Net Frock For Girls ( Pack of 1 , Blue )",Kids Fashion,355,64.46,0
"SUBRUNG FASHION Crepe Frock For Baby Girls ( Pack of 1 , Multicolor 1 )",Kids Fashion,389,75.69,0
"Villata fashion Net Frock For Girls ( Pack of 1 , White )",Kids Fashion,265,73.47,0
"A.W.A KIDS FASHION Cotton Blend Frock For Girls ( Pack of 1 , Red )",Kids Fashion,582,41.74,0
"Arshia Fashions Net Frock For Girls ( Pack of 1 , Light Blue )",Kids Fashion,381,78.82,0
"Arshia Fashions Net Lehenga Choli Sets For Girls ( , Red )",Kids Fashion,381,84.12,0
Arshia Fashions Boys Cotton Yellow Kurta Pant Set ( Pack of 1 ),Kids Fashion,440,75.54,0
"samjho fashion Net Frock For Baby Girls ( Pack of 1 , Green )",Kids Fashion,320,59.95,0
"PMD Fashion Net Lehenga Choli Set For Girls ( Pack of 1 , Rust )",Kids Fashion,355,64.46,0
NI FASHION Pack of 1 Boys Cotton Blend T-Shirt ( Multicolor ),Kids Fashion,171,65.73,0
TAZO Nylon Men's Windcheater Jacket - Blue ( Pack of 1 ),Men Clothing,462,66.98,0
yellow tree Polyester Men's Casual Jacket - White ( Pack of 1 ),Men Clothing,704,71.83,0
Reya Cotton Blend Men's Casual Jacket - Black ( Pack of 1 ),Men Clothing,429,71.38,0
Mashaykh Polyester Men's Windcheater Jacket - White ( Pack of 1 ),Men Clothing,682,65.88,0
eddicted Polyester Men's Puffer Jacket - Navy Blue ( Pack of 1 ),Men Clothing,617,52.5,0
Montrez Cotton Blend Men's Casual Jacket - White ( Pack of 1 ),Men Clothing,557,77.71,0
yellow tree Polyester Men's Casual Jacket - Black ( Pack of 1 ),Men Clothing,685,72.59,0
Rigo Polyester Men's Puffer Jacket - Grey ( Pack of 1 ),Men Clothing,691,82.72,0
IF-INDIAN FORT Polyester Men's Quilted & Bomber Jacket - Navy ( Pack of 1 ),Men Clothing,658,60.72,0
TrendsTalk Nylon Men's Windcheater Jacket - Blue ( Pack of 1 ),Men Clothing,576,61.57,0
Christy World Polyester Men's Casual Jacket - Black ( Pack of 1 ),Men Clothing,570,77.19,0
Mashaykh Polyester Men's Windcheater Jacket - Black ( Pack of 1 ),Men Clothing,657,67.13,0
Forbro Nylon Men's Windcheater Jacket - Black ( Pack of 1 ),Men Clothing,598,70.09,0
Montrez Cotton Blend Men's Casual Jacket - Olive ( Pack of 1 ),Men Clothing,557,77.71,0
AZF Nylon Men's Casual Jacket - Wine ( Pack of 1 ),Men Clothing,457,71.42,0
TrendsTalk Nylon Men's Windcheater Jacket - Gold ( Pack of 1 ),Men Clothing,429,78.54,0
eddicted Polyester Men's Puffer Jacket - Blue ( Pack of 1 ),Men Clothing,582,55.2,0
FTX Denim Men's Denim Jacket - Light Blue ( Pack of 1 ),Men Clothing,557,75.23,0
Forbro Nylon Men's Windcheater Jacket - Maroon ( Pack of 1 ),Men Clothing,598,70.09,0
Christy World Polyester Men's Casual Jacket - Grey ( Pack of 1 ),Men Clothing,429,71.38,0
Forbro Nylon Men's Windcheater Jacket - White ( Pack of 1 ),Men Clothing,598,70.09,0
Reya Cotton Blend Men's Casual Jacket - Maroon ( Pack of 1 ),Men Clothing,429,71.38,0
Mashaykh Polyester Men's Windcheater Jacket - Multicolor 2 ( Pack of 1 ),Men Clothing,682,65.88,0
Rigo Fleece Men's Casual Jacket - Grey ( Pack of 1 ),Men Clothing,612,74.49,0
Christy World Nylon Men's Windcheater Jacket - Black ( Pack of 1 ),Men Clothing,617,75.31,0
AZF Nylon Men's Windcheater Jacket - Olive ( Pack of 1 ),Men Clothing,457,71.42,0
Montrez Cotton Blend Men's Casual Jacket - Yellow ( Pack of 1 ),Men Clothing,557,77.71,0
AZF Nylon Men's Windcheater Jacket - Blue ( Pack of 1 ),Men Clothing,457,71.42,0
Eyebogler Polyester Men's Windcheater Jacket - Grey ( Pack of 1 ),Men Clothing,344,86.23,0
eddicted Nylon Men's Puffer Jacket - Maroon ( Pack of 1 ),Men Clothing,617,52.5,0
AZF Nylon Men's Windcheater Jacket - Navy ( Pack of 1 ),Men Clothing,457,71.42,0
eddicted Polyester Men's Biker Jacket - Navy Blue ( Pack of 1 ),Men Clothing,617,52.5,0
SCOLLER Polyester Men's Windcheater Jacket - Dark Grey ( Pack of 1 ),Men Clothing,517,76.49,0
eddicted Nylon Men's Biker Jacket - Grey ( Pack of 1 ),Men Clothing,617,52.5,0
FLIRTY SOUL Polyester Men's Casual Jacket - Multicolor ( Pack of 1 ),Men Clothing,712,67.62,0
eddicted Polyester Men's Windcheater Jacket - Black ( Pack of 1 ),Men Clothing,617,52.5,0
Eyebogler Polyester Men's Casual Jacket - Navy Blue ( Pack of 1 ),Men Clothing,666,48.73,0
SCOLLER Polyester Men's Windcheater Jacket - Olive ( Pack of 1 ),Men Clothing,517,76.49,0
Leotude Cotton Men's Casual Jacket - Black ( Pack of 1 ),Men Clothing,529,66.92,0
eddicted Polyester Men's Quilted & Bomber Jacket - Maroon ( Pack of 1 ),Men Clothing,617,52.5,0
Sheetal associates Women Polyester Printed Fit & Flare Dress ( Blue ),Women Clothing,394,60.56,0
wanquila Women Lycra Solid Bodycon Dress ( Beige ),Women Clothing,363,85.47,0
"KNOWZY Rayon Women Dupatta ( Magenta , Pack of 1 )",Women Clothing,108,81.97,0
Sheetal associates Women Crepe Printed A-line Dress ( Orange ),Women Clothing,339,66.07,0
TUHIRAJ Women Crepe Printed Gown ( Brown ),Women Clothing,470,52.95,0
Sheetal associates Women Polyester Printed Fit & Flare Dress ( Brown ),Women Clothing,394,60.56,0
"BLYNK Lycra Petticoat ( Pink , )",Women Clothing,171,86.84,0
Fabverse Women Lycra Solid Bodycon Dress ( Black ),Women Clothing,319,78.72,0
Sheetal associates Women Crepe Printed Shirt Dress ( Green ),Women Clothing,394,60.56,0
Honky Tonky Women Polyester Self Design A-line Dress ( Pink ),Women Clothing,382,61.76,0
Sheetal associates Women Crepe Printed Shirt Dress ( White ),Women Clothing,394,60.56,0
JASH CREATION Women Cotton Blend Printed Fit & Flare Dress ( Pink ),Women Clothing,356,82.19,0
Sheetal associates Women Crepe Printed A-line Dress ( White ),Women Clothing,394,60.56,0
Fasanger Cotton Lycra Women's Shrugs - White ( ),Women Clothing,244,90.24,0
Madhusudan Women Rayon Printed Ethnic Dress ( Pink ),Women Clothing,452,76.2,0
THE LADIES FASHION Women Viscose Rayon Maxi ( White ),Women Clothing,391,75.55,0
Sheetal associates Women Crepe Printed Fit & Flare Dress ( White ),Women Clothing,394,60.56,0
NIVESTANA Women Viscose Rayon Gown ( Purple ),Women Clothing,393,75.42,0
PIYURZ Pack of 6 Poly Cotton Solid Women's Briefs ( Multi Color ),Women Clothing,207,73.76,0
MAYRAAFASHION Net Self Design Regular Saree With Unstitched Blouse Piece ( Pink ),Women Clothing,448,70.13,0
"DELTIN HUB Polyester Petticoat ( Blue , )",Women Clothing,234,66.52,0
Fasanger Cotton Lycra Women's Shrugs - Blue ( ),Women Clothing,281,88.76,0
Vkaran Lycra Cut Outs Saree With Unstitched Blouse Piece ( Black ),Women Clothing,299,85.04,0
color bucket Women Net Circular Semi Stitched Lehenga Choli ( Beige ),Women Clothing,377,81.14,0
Tankirti Cotton Printed Women Regular Nighty ( Blue ),Women Clothing,323,89.23,0
PuriMaa Blue Organza Circular Semi Stitched Lehenga,Women Clothing,765,73.61,0
DOOZIE LOVEPLUS Pack of 6 Poly Cotton Printed Women's Hipster ( Multicolor ),Women Clothing,204,79.58,0
shrihub - Cotton Red Women's Semi Patiala Salwar ( Pack of 1 ),Women Clothing,210,64.94,0
Kashtbhanjan Women Art Silk Straight Cut Unstitched Lehenga Choli ( Blue ),Women Clothing,514,74.29,0
Lecowar Women Fleece Hooded Sweatshirt For ( Maroon ),Women Clothing,424,77.67,0
SELVIFAB Maroon Crepe Regular Fit Women's Jumpsuit ( Pack of 1 ),Women Clothing,311,76.06,0
"BLYNK Lycra Petticoat ( Multicoloured , )",Women Clothing,268,82.12,0
ALTECIA Women Net Indo-Western Semi Stitched Lehenga Choli ( Black ),Women Clothing,468,33.05,0
Vibhagyaa Georgette Printed Saree With Unstitched Blouse Piece ( Black ),Women Clothing,251,74.87,0
"Anjaneya Creations Women Cotton Blend Dupatta ( Black , Pack of 1 )",Women Clothing,241,51.7,0
Ishant Pack of 3 Cotton Non Padded Everyday Bra For Women ( Multicolor ),Women Clothing,196,75.47,0
YUGAVEERAA Lycra Solid Regular Saree With Unstitched Blouse Piece ( Blue ),Women Clothing,299,66.25,0
Rajnandini Unstitched Cotton Blend Printed Dress Material - Black ( Pack of 1 ),Women Clothing,363,78.17,0
THAWE PARIDHAN Women Cotton Blend Printed Oversized Fit Round Neck T-Shirt ( White ),Women Clothing,224,77.58,0
"TAMINA Black,White Cotton Blend Women's Flared Skirt ( Pack of 1 )",Women Clothing,332,77.85,0
