Section,Product,Price,Discount,Rating
Accessories,Blubby Multi Clutcher ( Pack of 1 ),213,79,3.7
Accessories,Ezybe Self Adhesive Kichen Shelf Light Blue Plastic Storage Racks (Pack of 2),173,83,2.7
Accessories,AUTOGROOMZ Windshield Only Double Clamp Car Mobile Holder - Black,217,82,3.0
Accessories,"Portronics Clamp M3 Adjustable Car Mobile Phone Holder Stand for Dashboard & Windshield, 360degree Rotational, Strong Suction Cup, Compatible with 4 to 6 inch Devices(Black)",268,70,4.2
Accessories,Car Ashtrays Multi Color,176,75,4.4
Accessories,QitmirMKT NEW KEYCHAIN LIGHTER WITH HIGH POWER LIGHT Multicolor Multipurpose Car Cigarette Lighter ( Pack of 1 ),238,76,3.9
Accessories,"delhideals Indian Flag for Car Dashboard, Office Table, Study Table & Drawing Table",195,67,3.1
Accessories,GEEO Accu Pressure Bead Back / Lumbar Support Single Black,223,78,3.2
Accessories,"5 In 1 Multi Pin Universal Portable Adapter And Car Mobile Charging Cable For (iPhone,Type C and Micro USB)",254,75,2.5
Accessories,Vertical9 Car Mobile Charger 3_in_1 cable Multicolour,240,78,2.9
Accessories,"GEEO Universal Car Steering Knob, Car Steering Wheel Knob, Steering Wheel Spinner Knob, 360° Rotation Booster (3R Original)",331,67,2.8
Accessories,RONISH Neck Cushions Set of 2 Black,160,68,4.2
Accessories,"Aksmit Pack of -1 Car Gear Knob Protector Gear Shifter Cover for Anti-Scratch Car Gear Knob Cover and Dust Proof Nonslip Gear Cover for Car Universal Fit Silicon Car Gear Knob Stylish- Black, Silicone Rubber",187,53,3.7
Accessories,"Aksmit Waterproof and Non-slip Leather Floor Mats, Car Floor Mat Accessories, Black gold",1472,13,2.6
Accessories,Anshri White Plastic Storage Racks ( Pack of 4 ),250,75,4.1
Accessories,mahek accessories for Headrest Black,137,86,3.2
Accessories,Digital Car Dashboard Alarm Clock and Stopwatch With Flexible Stand,180,55,4.0
Accessories,Tender care Memory Foam Back / Lumbar Support Single Black,350,77,2.9
Accessories,Aksmit 4 Pieces 12 LED DC 12V Multicolour Music Car Strip Atmosphere Lamp Light for Car Interior Under Dash Lighting Kit with Sound Active Function and Wireless Control,338,52,2.5
Accessories,Aksmit Premium Metal Key Cover Compitable for Maruti Suzuki Ignis,434,57,2.3
Accessories,JAGIRA DIVINE TOUCH Multicolor Plastic Storage Racks ( Pack of 1 ),116,83,4.1
Accessories,"TANTRA Car Armrest Cover Cushion with 2 Storage Bags - Soft, Comfortable, Non-Slip Protector for Vehicle Center Console - Waterproof, Durable, and Stylish",365,63,2.1
Accessories,CRAYLUXE Accu Pressure Bead Back / Lumbar Support Single Black,538,64,2.5
Accessories,Sonal Brown Plastic Storage Racks ( Pack of 1 ),500,38,4.4
Accessories,RONISH Steering Cover Leatherite,395,60,2.6
Accessories,AKSMIT Dashboard Fan Black,508,27,4.0
Accessories,Anshri White Plastic Kitchen Dispenser ( Pack of 2 ),167,67,2.3
Accessories,AKSMIT Dashboard Fan Black,586,27,3.0
Accessories,"Premium Car Seat Belt Cover - Comfort & Safety Enhancer - Adjustable, Soft, & Stylish - Universal Fit for All Vehicles",278,72,4.1
Accessories,CarFrill Gear Knob Silicone for 5 Speed Gear,288,64,3.3
Accessories,4 Color 17 CM DRL Strip,187,63,3.2
Accessories,Bhavyta Night Vision Visor Plastic Yellow,441,56,3.2
Accessories,"Portronics Car Power 5 Car Charger with Dual USB Ports ,Black (POR 1345) wihtout cable",204,59,4.1
Accessories,SPIX Black Stainless Steel Storage Racks ( Pack of 2 ),262,74,3.6
Accessories,star light for car interior,233,77,2.2
Accessories,RONISH Steering Cover Leatherite,446,55,2.7
Accessories,Anshri Black Plastic Kitchen Dispenser ( Pack of 2 ),187,63,4.6
Accessories,swanoll Light Grey Plastic Kitchen Trolleys ( Pack of 1 ),326,53,3.8
Accessories,"Masala Rangoli Box Dabba for Keeping Spices, Spice Box for Kitchen, Plastic Wooden Style Masala Box, Masala Container, Masala Dabba",171,83,3.8
Accessories,Winstar - Silver Stainless Steel Wall mount Stand ( Pack of 1 ),790,74,2.9
Accessories,GEEO Black Non Woven Dish Racks ( Pack of 1 ),191,81,3.3
Accessories,Crust Laptop Charger / Inverter N80 Black,1382,62,3.7
Accessories,"KTU Car Plastic Backseat Headrest Hook/Hanger Universal Durable Organiser Space Saver for Handbag, Wallets, Grocery Bags (Black, Pack of 4)",133,73,3.1
Accessories,Anshri Silver Steel Kitchen Cloth Hook ( Pack of 2 ),178,55,3.4
Accessories,SWASTICK Black Stainless Steel Storage Racks ( Pack of 2 ),281,77,3.7
Accessories,"KP Mart Multi Functional Makeup Storage Box with Holder Dust Proof Cosmetic Organizer Water Proof Box for Desktop Bathroom, Dresser, Vanity and Countertop Cosmetic Box Plastic",197,80,2.9
Accessories,Anshri Multicolor Plastic Wall mount Stand ( Pack of 2 ),159,60,4.4
Accessories,"Premium Metal Key Cover Compitable for Suzuki Swift|Ertiga|Wagonr|Celerio|Swift Dzire|Alto|Fronx|Breza|S Presso|Ignis 2 Button Remote Key, Brown and Black",460,42,4.1
Accessories,RONISH Steering Cover Leatherite,300,62,2.8
Accessories,KP Mart Electronic Kitchen Digital Weighing Scale Multipurpose 10 Kg (SF 400A),626,37,3.0
Accessories,"48Inch Ice Blue & Red DRL LED Brake with Side Turn Signal & Parking Indication Trunk,Boot,Dicky Light For Innova 2005-12",388,61,3.7
Accessories,Anshri Orange Plastic Storage Racks ( Pack of 1 ),219,45,3.8
Accessories,CarFrill Steering Cover Leather,269,66,2.5
Accessories,GEEO White Steel Storage Racks ( Pack of 1 ),180,82,2.8
Accessories,JISUN Chakla Belan Stand Silver Stainless Steel Rolling Pin Holder ( Pack of 1 ),158,68,4.1
Accessories,"SIAGO Premium Car Keys Keychain - Durable Metal Key Holder for Cars, Bike Key Chain",361,76,2.6
Accessories,12 LED Multicolor Music Controlled Sound Activated for Car Interior Atmosphere Light (Works with All Cars) Pack Of-1,351,50,3.0
Accessories,Skylii - Olive Plastic Fruit & Vegetable Trolley ( Pack of 1 ),257,74,2.8
Accessories,"Valdez Silicon Car Key Cover Shell for maruti suzuki swift, dzire, baleno, ertiga",155,83,2.1
Accessories,ALCY Silver Steel Dish Racks ( Pack of 1 ),782,61,2.4
Footwear,Cozy Wear Black Men's Daily Slipper,183,63,2.2
Footwear,Xtoon Grey Men's Outdoor Shoes,498,67,2.3
Footwear,AROTEK Grey Men's Daily Slipper,191,76,4.6
Footwear,PENNEN Green Women's Flats,270,66,3.4
Footwear,Dream Makers - Black Women's Sandal Heels,407,73,3.6
Footwear,Cozy Wear Brown Men's Daily Slipper,193,61,4.1
Footwear,YOU LIkE Brown Men's Derby Formal Shoes,693,80,2.6
Footwear,FUSEOWL Maroon Women's Flip Flop,171,83,4.4
Footwear,PERY PAO Blue Men's Slide Flip Flop,226,77,2.8
Footwear,YNP Design Collections Brown Women's Ethnic Ballerinas,411,18,2.7
Footwear,Densu Black Men's Korean Shoes,597,60,2.9
Footwear,Cozy Wear Olive Men's Daily Slipper,193,61,4.5
Footwear,hanuco Height Increasing Insoles,301,70,3.3
Footwear,Radhe Creation Cream Polish Suitable for Black Color,197,67,4.0
Footwear,Squash Black Men's Thong Flip Flop,230,67,2.5
Footwear,WildProducts All Type Shoes Cleaner,148,85,3.7
Footwear,Citipiti ind. Green Women's Flats,208,70,3.8
Footwear,BEE U NIK Black Men's Thong Flip Flop,176,65,3.5
Footwear,LiteHawks Green Men's Daily Slipper,220,78,3.3
Footwear,Skindora Cream Polish Suitable for MultiColor Color,189,68,4.5
Footwear,lyvi Black Men's Daily Slipper,187,79,3.2
Footwear,Xtoon Multi Color Men's Korean Shoes,548,63,3.4
Footwear,Cozy Wear Black Men's Daily Slipper,214,57,3.0
Footwear,Altek PeachPuff Women's Flats,244,51,2.9
Footwear,Stylestry Gray Women's Sandal Heels,518,74,3.8
Footwear,Z Brown Men's Slide Flip Flop,279,65,3.4
Footwear,Leeport - Brown Men's Slip On Formal Shoes,610,76,3.0
Footwear,FUSEOWL Purple Women's Toe Covered Flip Flop,278,72,2.4
Footwear,Jumpback Peach Women's Casual Ballerinas,240,76,4.7
Footwear,ROGZI Cream Polish Suitable for Neutral Color,181,9,3.6
Footwear,Campus Oxyfit (N) Navy Blue Men's Slip-on Shoes,622,38,2.1
Footwear,Bersache - Light Grey Boy's Clogs ( 1 Pair ),364,82,4.0
Footwear,ZYPSO Zypso Men?s Grey Synthetic Grey Men's Lifestyle Shoes,559,72,3.8
Footwear,RITA-KIDS-HAWAI-MINIPANDA5STUDD-SLIPPER,155,63,3.3
Footwear,PENNEN White Men's Lifestyle Shoes,552,45,3.3
Footwear,"ADISO Trendy ,outdoor stylish casual White Men's Outdoor Shoes",597,80,2.2
Footwear,PENNEN Blue Women's Flats,270,66,3.0
Footwear,PENNEN White Men's Lifestyle Shoes,393,61,2.2
Footwear,Seafoot White Men's Outdoor Shoes,317,68,3.6
Footwear,Bersache Gray Clogs,472,76,3.6
Footwear,Stylestry Silver Women's Flats,447,78,2.7
Footwear,Shoetopia Red Women's Sandal Heels,594,70,3.8
Footwear,KATENIA - Black Men's Oxford Formal Shoes,528,74,3.5
Footwear,FUSEOWL Light Grey Women's Toe Covered Flip Flop,250,75,4.1
Footwear,YNP Design Collections Black Women's Ethnic Ballerinas,411,18,3.0
Footwear,Modern Stylish Kids Girls Casual Partywear Soft Padded Sandals,302,91,3.8
Footwear,secritas Boys & Girls Slip On Slipper Flip Flop,182,82,4.2
Footwear,Paduki Silver Women's Flats,277,60,4.6
Footwear,MAAN Black Women's Gladiators Flats,216,78,2.9
Footwear,Paduki Gray Women's Flats,308,56,2.5
Footwear,Citipiti ind. Gray Women's Flats,208,70,2.8
Footwear,Paduki Gold Women's Flats,280,60,4.7
Footwear,Altek Silver Women's Flats,296,70,3.6
Footwear,BHAVYTA COSMETIC Cream Polish Suitable for White Color,160,82,2.9
Footwear,KHADIM Beige Flats,480,31,2.9
Footwear,Altek Green Women's Flats,244,51,3.6
Footwear,Stylestry Black Women's Flats,423,79,2.7
Footwear,Paduki White Women's Flats,332,53,3.9
Footwear,PM Traders Black Women's Flats,406,59,4.5
Footwear,Coolz Kids Chu-Chu Sound Musical Sandals C-06 for Baby Boys and Girls Age 1-3 Years,256,74,3.2
Kids Fashion,Cool and NIce kids Multi color Bermuda pack of 5,341,43,3.2
Kids Fashion,"A.W.A KIDS FASHION Cotton Frock For Girls ( Pack of 1 , Blue )",382,45,3.3
Kids Fashion,"A.W.A KIDS FASHION Cotton Blend Frock For Girls ( Pack of 1 , Pink )",382,62,3.4
Kids Fashion,"A.W.A KIDS FASHION Cotton Blend Frock For Girls ( Pack of 1 , Light Blue )",382,62,3.0
Kids Fashion,"Arshia Fashions Polyester Shirt Dress For Girls ( Pack of 1 , Multicolor )",561,72,2.1
Kids Fashion,"Arshia Fashions Net Lehenga Choli Sets For Girls ( , Blue )",381,84,3.5
Kids Fashion,"Arshia Fashions Girls Cotton Blend Kurti with Sharara ( Pack of 1 , Pink )",561,84,4.6
Kids Fashion,"Villata fashion Net Frock For Girls ( Pack of 1 , White )",275,72,3.8
Kids Fashion,"Nios Fashion Girls Cotton Polyester Jeans ( Pack of 2 , Multicolor 4 )",355,61,2.3
Kids Fashion,s muktar garments - Green Cotton Blend Boys Professional Costume ( Pack of 1 ),311,56,2.1
Kids Fashion,KIDS CLUB Pack of 1 Boys 100% Cotton Full Sleeves Shirt ( Green ),355,73,4.2
Kids Fashion,"Arshia Fashions Cotton Blend Shirt Dress For Girls ( Pack of 1 , Blue )",501,75,4.6
Kids Fashion,"PMD Fashion Net Lehenga Choli Set For Girls ( Pack of 1 , Charcoal )",355,64,2.6
Kids Fashion,NI FASHION Pack of 1 Boys Cotton Blend T-Shirt ( Green ),171,66,3.2
Kids Fashion,"A.W.A KIDS FASHION Cotton Blend Frock For Girls ( Pack of 1 , Red )",582,42,3.5
Kids Fashion,"Villata fashion Net Frock For Girls ( Pack of 1 , Red )",331,67,4.3
Kids Fashion,NAYPAL FASHION STYLE Pack of 1 Boys & Girls Cotton Blend T-Shirt ( Pink ),246,75,2.1
Kids Fashion,"SUBRUNG FASHION Crepe Frock For Baby Girls ( Pack of 1 , Multicolor 1 )",389,76,4.2
Kids Fashion,"Villata fashion Net Frock For Girls ( Pack of 1 , Red )",290,71,2.3
Kids Fashion,"A.W.A KIDS FASHION Cotton Blend Frock For Girls ( Pack of 1 , Green )",582,42,3.4
Kids Fashion,"Villata fashion Net Frock For Girls ( Pack of 1 , Sky Blue )",331,67,2.5
Kids Fashion,"Arshia Fashions Net Lehenga Choli Sets For Girls ( , Red )",381,84,3.5
Kids Fashion,"Arshia Fashions Girls Cotton Blend Patiala Kurta Set ( Pack of 1 , Green )",561,78,2.5
Kids Fashion,"Nios Fashion Girls Cotton Polyester Jeans ( Pack of 2 , Multicolor 1 )",355,61,3.4
Kids Fashion,"Vidya Fashions Net Frock For Girls ( Pack of 1 , Pink )",482,63,4.4
Kids Fashion,KIDS CLUB Pack of 1 Boys 100% Cotton Full Sleeves Shirt ( Peach ),336,74,4.2
Kids Fashion,NI FASHION Pack of 1 Boys Cotton Blend T-Shirt ( Black ),171,66,4.3
Kids Fashion,"Villata fashion Net Frock For Girls ( Pack of 1 , Red )",262,74,4.3
Kids Fashion,"Arshia Fashions Net Lehenga Choli Set For Girls ( Pack of 1 , Green )",620,74,4.0
Kids Fashion,NI FASHION Pack of 1 Boys Cotton Blend T-Shirt ( Purple ),171,66,3.9
Kids Fashion,"A.W.A KIDS FASHION Cotton Blend Frock For Girls ( Pack of 1 , Black )",582,42,2.9
Kids Fashion,"Villata fashion Net Frock For Girls ( Pack of 1 , White )",331,67,2.6
Kids Fashion,New Collections Uniform,281,72,4.3
Kids Fashion,"Vidya Fashions Net Frock For Girls ( Pack of 1 , Pink )",482,63,2.7
Kids Fashion,"Villata fashion Net Frock For Girls ( Pack of 1 , White )",265,73,4.6
Kids Fashion,"Villata fashion Net Frock For Girls ( Pack of 1 , Blue )",281,72,2.6
Kids Fashion,KASEERA CUTE STYLISH AND TRENDING KIDS GYM VEST PACK OF 5,273,61,2.9
Kids Fashion,"samjho fashion Net Gown For Girls ( Pack of 1 , Pink )",149,85,4.3
Kids Fashion,"Arshia Fashions Polyester Blend Frock For Girls ( Pack of 1 , Red )",321,79,2.5
Kids Fashion,NI FASHION Pack of 1 Boys Cotton Blend T-Shirt ( Red ),171,66,2.6
Kids Fashion,"Villata fashion Net Frock For Girls ( Pack of 1 , Pink )",331,67,3.6
Kids Fashion,"Arshia Fashions Polyester Fit And Flare Dress For Girls ( Pack of 1 , Blue )",561,72,4.1
Kids Fashion,"Nios Fashion Girls Cotton Polyester Jeans ( Pack of 2 , Multicolor 3 )",355,61,2.7
Kids Fashion,KIDS CLUB Pack of 1 Boys 100% Cotton Full Sleeves Shirt ( White ),355,73,3.4
Kids Fashion,"PMD Fashion Net Lehenga Choli Set For Girls ( Pack of 1 , Rust )",355,64,4.2
Kids Fashion,NI FASHION Pack of 1 Boys Cotton Blend T-Shirt ( Light Green ),171,66,4.7
Kids Fashion,"Villata fashion Net Frock For Girls ( Pack of 1 , Pink )",290,71,3.8
Kids Fashion,Niicce Fashion Pack of 3 Girls Georgette Frock and Trackpant ( Blue ),508,68,4.4
Kids Fashion,"Arshia Fashions Polyester Fit And Flare Dress For Girls ( Pack of 1 , Purple )",561,72,4.6
Kids Fashion,"Dhvra Fashion Girls Georgette Kurti with Palazzo ( Pack of 1 , BLUE )",482,52,3.3
Kids Fashion,"Villata fashion Net Frock For Girls ( Pack of 1 , Blue )",275,72,2.9
Kids Fashion,"Villata fashion Net Frock For Girls ( Pack of 1 , Pink )",355,64,3.2
Kids Fashion,NI FASHION Pack of 1 Boys Cotton Blend T-Shirt ( Sky Blue ),171,66,3.9
Kids Fashion,"PMD Fashion Net Lehenga Choli Set For Girls ( Pack of 1 , Wine )",355,64,4.4
Kids Fashion,"samjho fashion Net Frock For Baby Girls ( Pack of 1 , Green )",320,60,3.1
Kids Fashion,"Arshia Fashions Baby Girls Cotton Blend Kurti with Salwar ( Pack of 1 , Green )",440,78,3.9
Kids Fashion,"Villata fashion Net Frock For Girls ( Pack of 1 , Blue )",355,64,2.2
Kids Fashion,Arshia Fashions Pack of 1 Boys Cotton Blend ( Yellow ),471,76,2.6
Kids Fashion,Shiv Fashion Pack of 1 Boys Cotton Blend T-Shirt & Trackpants Set ( White ),482,63,3.8
Kids Fashion,"Nios Fashion Girls Cotton Polyester Jeans ( Pack of 2 , Multicolor 5 )",355,61,2.8
Men Clothing,Montrez Cotton Blend Men's Casual Jacket - White ( Pack of 1 ),557,78,3.0
Men Clothing,FTX Denim Men's Denim Jacket - Light Blue ( Pack of 1 ),557,75,3.4
Men Clothing,Montrez Cotton Blend Men's Casual Jacket - Olive ( Pack of 1 ),557,78,3.5
Men Clothing,eddicted Polyester Men's Puffer Jacket - Navy Blue ( Pack of 1 ),617,53,4.4
Men Clothing,TrendsTalk Nylon Men's Windcheater Jacket - Gold ( Pack of 1 ),429,79,2.5
Men Clothing,Reya Cotton Blend Men's Casual Jacket - Maroon ( Pack of 1 ),429,71,3.6
Men Clothing,yellow tree Polyester Men's Casual Jacket - White ( Pack of 1 ),704,72,3.8
Men Clothing,Rigo Polyester Men's Puffer Jacket - Grey ( Pack of 1 ),691,83,2.5
Men Clothing,eddicted Polyester Men's Puffer Jacket - Blue ( Pack of 1 ),582,55,2.2
Men Clothing,Reya Cotton Blend Men's Casual Jacket - Blue ( Pack of 1 ),429,71,3.1
Men Clothing,TAZO Nylon Men's Windcheater Jacket - Blue ( Pack of 1 ),462,67,4.2
Men Clothing,Reya Cotton Blend Men's Casual Jacket - Black ( Pack of 1 ),429,71,3.5
Men Clothing,Mashaykh Polyester Men's Windcheater Jacket - White ( Pack of 1 ),682,66,4.3
Men Clothing,Forbro Nylon Men's Windcheater Jacket - Maroon ( Pack of 1 ),598,70,4.0
Men Clothing,Mashaykh Polyester Men's Windcheater Jacket - Black ( Pack of 1 ),657,67,3.6
Men Clothing,Forbro Nylon Men's Windcheater Jacket - Black ( Pack of 1 ),598,70,3.3
Men Clothing,Rigo Fleece Men's Casual Jacket - Grey ( Pack of 1 ),612,74,3.3
Men Clothing,yellow tree Polyester Men's Casual Jacket - Multicolor ( Pack of 1 ),722,64,3.2
Men Clothing,Christy World Nylon Men's Windcheater Jacket - Black ( Pack of 1 ),617,75,3.3
Men Clothing,TrendsTalk Nylon Men's Windcheater Jacket - Blue ( Pack of 1 ),576,62,2.1
Men Clothing,AZF Nylon Men's Windcheater Jacket - Olive ( Pack of 1 ),457,71,3.2
Men Clothing,Christy World Polyester Men's Casual Jacket - Black ( Pack of 1 ),570,77,4.2
Men Clothing,AZF Nylon Men's Windcheater Jacket - Dark Grey ( Pack of 1 ),457,71,2.6
Men Clothing,Mashaykh Polyester Men's Windcheater Jacket - Multicolor 2 ( Pack of 1 ),682,66,2.4
Men Clothing,AZF Nylon Men's Casual Jacket - Wine ( Pack of 1 ),457,71,3.8
Men Clothing,IF-INDIAN FORT Polyester Men's Quilted & Bomber Jacket - Navy ( Pack of 1 ),658,61,4.4
Men Clothing,AZF Nylon Men's Windcheater Jacket - Navy ( Pack of 1 ),457,71,2.4
Men Clothing,eddicted Nylon Men's Biker Jacket - Grey ( Pack of 1 ),617,53,4.0
Men Clothing,AZF Nylon Men's Windcheater Jacket - Blue ( Pack of 1 ),457,71,3.3
Men Clothing,eddicted Polyester Men's Quilted & Bomber Jacket - Maroon ( Pack of 1 ),617,53,2.9
Men Clothing,Forbro Nylon Men's Windcheater Jacket - White ( Pack of 1 ),598,70,3.1
Men Clothing,Montrez Cotton Blend Men's Casual Jacket - Yellow ( Pack of 1 ),557,78,3.0
Men Clothing,Eyebogler Polyester Men's Windcheater Jacket - Grey ( Pack of 1 ),344,86,3.1
Men Clothing,LONDON HILLS Polyester Men's Casual Jacket - Black ( Pack of 1 ),360,72,4.2
Men Clothing,eddicted Polyester Men's Windcheater Jacket - Maroon ( Pack of 1 ),617,53,3.7
Men Clothing,Leotude Fleece Men's Casual Jacket - Black ( Pack of 1 ),529,67,2.8
Men Clothing,eddicted Polyester Men's Windcheater Jacket - Black ( Pack of 1 ),617,53,4.5
Men Clothing,SCOLLER Polyester Men's Windcheater Jacket - Blue ( Pack of 1 ),545,75,3.7
Men Clothing,eddicted Polyester Men's Windcheater Jacket - Grey ( Pack of 1 ),617,53,2.3
Men Clothing,Maniac Fleece Men's Casual Jacket - Multicolor ( Pack of 1 ),422,85,4.1
Men Clothing,THECLASSICTOGS Polyester Men's Windcheater Jacket - Black ( Pack of 1 ),564,57,3.9
Men Clothing,Club York Denim Men's Denim Jacket - Grey ( Pack of 1 ),762,78,2.2
Men Clothing,Rigo Fleece Men's Casual Jacket - Black ( Pack of 1 ),493,69,2.9
Men Clothing,SCOLLER Polyester Men's Windcheater Jacket - Olive ( Pack of 1 ),517,76,2.3
Men Clothing,MAYKR Polyester Men's Windcheater Jacket - White ( Pack of 1 ),774,61,2.2
Men Clothing,THECLASSICTOGS Polyester Men's Windcheater Jacket - Grey ( Pack of 2 ),545,58,4.3
Men Clothing,Dollar Polyester Men's Windcheater Jacket - Navy ( Pack of 1 ),750,50,2.5
Men Clothing,FTX Fleece Men's Casual Jacket - Navy ( Pack of 1 ),507,71,2.2
Men Clothing,Dollar Cotton Blend Men's Casual Jacket - Green ( Pack of 1 ),614,63,2.4
Men Clothing,TAZO Nylon Men's Casual Jacket - Grey ( Pack of 1 ),424,70,3.3
Men Clothing,TrendsTalk Nylon Men's Windcheater Jacket - Navy ( Pack of 1 ),429,79,2.5
Men Clothing,SCOLLER Polyester Men's Windcheater Jacket - Dark Grey ( Pack of 1 ),517,76,2.5
Men Clothing,FTX Polyester Men's Casual Jacket - Black ( Pack of 1 ),457,77,2.9
Men Clothing,Dollar Cotton Men's Casual Jacket - Navy ( Pack of 1 ),621,64,2.5
Men Clothing,TrendsTalk Nylon Men's Windcheater Jacket - Maroon ( Pack of 1 ),429,79,2.7
Men Clothing,Dollar Cotton Men's Casual Jacket - Black ( Pack of 1 ),578,65,3.1
Men Clothing,FTX Polyester Men's Windcheater Jacket - Black ( Pack of 1 ),457,77,3.1
Men Clothing,Club York Denim Men's Denim Jacket - Blue ( Pack of 1 ),785,78,3.6
Men Clothing,freaks Woollen Men's Puffer Jacket - Camel ( Pack of 1 ),712,64,4.5
Men Clothing,TrendsTalk Nylon Men's Windcheater Jacket - Olive ( Pack of 1 ),576,62,4.7
Women Clothing,Sheetal associates Women Polyester Printed Fit & Flare Dress ( Blue ),394,61,4.5
Women Clothing,TUHIRAJ Women Crepe Printed Gown ( Brown ),470,53,2.7
Women Clothing,"KNOWZY Rayon Women Dupatta ( Magenta , Pack of 1 )",108,82,2.8
Women Clothing,Sheetal associates Women Crepe Printed Shirt Dress ( White ),394,61,3.4
Women Clothing,wanquila Women Lycra Solid Bodycon Dress ( Beige ),363,85,3.9
Women Clothing,Sheetal associates Women Crepe Printed Shirt Dress ( Green ),394,61,3.4
Women Clothing,"BLYNK Lycra Petticoat ( Maroon , )",171,87,2.5
Women Clothing,Fabverse Women Lycra Solid Bodycon Dress ( Black ),319,79,4.4
Women Clothing,Sheetal associates Women Crepe Printed Fit & Flare Dress ( White ),394,61,3.0
Women Clothing,THE LADIES FASHION Women Viscose Rayon Maxi ( White ),391,76,4.1
Women Clothing,Sheetal associates Women Crepe Printed A-line Dress ( Orange ),339,66,4.7
Women Clothing,JASH CREATION Women Cotton Blend Printed Fit & Flare Dress ( Pink ),356,82,4.2
Women Clothing,Honky Tonky Women Polyester Self Design A-line Dress ( Pink ),382,62,3.2
Women Clothing,color bucket Women Net Circular Semi Stitched Lehenga Choli ( Beige ),377,81,3.3
Women Clothing,Madhusudan Women Rayon Printed Ethnic Dress ( Pink ),452,76,2.1
Women Clothing,Sheetal associates Women Polyester Printed Fit & Flare Dress ( Brown ),394,61,4.0
Women Clothing,Sheetal associates Women Crepe Printed A-line Dress ( White ),394,61,4.0
Women Clothing,NIVESTANA Women Viscose Rayon Gown ( Purple ),393,75,2.9
Women Clothing,Vkaran Lycra Cut Outs Saree With Unstitched Blouse Piece ( Black ),299,85,4.5
Women Clothing,PIYURZ Pack of 6 Poly Cotton Solid Women's Briefs ( Multi Color ),207,74,3.2
Women Clothing,"BLYNK Lycra Petticoat ( Pink , )",171,87,4.7
Women Clothing,Kashtbhanjan Women Art Silk Straight Cut Unstitched Lehenga Choli ( Blue ),514,74,4.3
Women Clothing,MAYRAAFASHION Net Self Design Regular Saree With Unstitched Blouse Piece ( Pink ),448,70,2.6
Women Clothing,Tankirti Cotton Printed Women Regular Nighty ( Blue ),323,89,4.5
Women Clothing,Shri Hub Cotton Women White Salwar,220,63,4.3
Women Clothing,ALTECIA Women Net Indo-Western Semi Stitched Lehenga Choli ( Black ),468,33,2.7
Women Clothing,DOOZIE LOVEPLUS Pack of 6 Poly Cotton Printed Women's Hipster ( Multicolor ),204,80,4.7
Women Clothing,ZWERLON Orange Polyester Women's Flared Skirt ( Pack of 1 ),360,82,2.2
Women Clothing,"Ladyland Cotton Hipster ( Multicolor , Pack of 3 )",157,88,4.1
Women Clothing,Fasanger Cotton Lycra Women's Shrugs - Blue ( ),281,89,3.3
Women Clothing,PuriMaa White Organza Circular Semi Stitched Lehenga,765,74,3.1
Women Clothing,Vibhagyaa Georgette Printed Saree With Unstitched Blouse Piece ( Black ),251,75,4.4
Women Clothing,YUGAVEERAA Lycra Solid Regular Saree With Unstitched Blouse Piece ( Blue ),299,66,2.4
Women Clothing,"Anjaneya Creations Women Cotton Blend Dupatta ( Black , Pack of 1 )",241,52,4.6
Women Clothing,Lecowar Women Fleece Hooded Sweatshirt For ( Maroon ),424,78,3.0
Women Clothing,COMFY ATTIRE Brown Cotton Women's Tiered Skirt ( Pack of 1 ),491,69,3.3
Women Clothing,color bucket Blue Net Circular Semi Stitched Lehenga Single,377,81,3.3
Women Clothing,CHALODIA Black Denim Women's Straight Skirts ( Pack of 1 ),580,77,3.1
Women Clothing,shrihub - Cotton Red Women's Semi Patiala Salwar ( Pack of 1 ),210,65,2.4
Women Clothing,JILUDI Georgette Solid Saree With Unstitched Blouse Piece ( Yellow ),324,78,4.5
Women Clothing,"DELTIN HUB Polyester Petticoat ( White , )",234,67,4.1
Women Clothing,PuriMaa Beige Organza Circular Semi Stitched Lehenga,765,74,2.6
Women Clothing,SHREE SANT SAREES Women Jacquard Straight Cut Unstitched Lehenga Choli ( Multicolor ),678,81,3.8
Women Clothing,"TAMINA Black,White Cotton Blend Women's Flared Skirt ( Pack of 1 )",332,78,2.6
Women Clothing,DOOZIE LOVEPLUS Pack of 3 Cotton Printed Women's Hipster ( Multicolor ),158,68,3.8
Women Clothing,Fasanger Cotton Lycra Women's Shrugs - White ( ),244,90,2.9
Women Clothing,PuriMaa Blue Organza Circular Semi Stitched Lehenga,765,74,2.4
Women Clothing,Lecowar Women Fleece Hooded Sweatshirt For ( Maroon ),424,78,3.3
Women Clothing,COMFY ATTIRE White Cotton Women's Flared Skirt ( Pack of 1 ),416,68,3.1
Women Clothing,PuriMaa Black Organza Circular Semi Stitched Lehenga,765,74,3.4
Women Clothing,Sttoffa Blue Cotton Women's Flared Skirt ( Pack of 1 ),568,62,4.2
Women Clothing,RIYA ENTERPRISE Chiffon Solid Regular Saree With Unstitched Blouse Piece ( Gold ),404,69,3.6
Women Clothing,Rajnandini Unstitched Cotton Blend Printed Dress Material - Multicolor 8 ( Pack of 1 ),363,82,3.2
Women Clothing,Fit BodyBra Pack of 3 Cotton Blend Non Padded Everyday Bra For Women ( Multicolor ),216,78,2.4
Women Clothing,ATIMUNA Gold Polyester Women Baby Doll Dress With Panty,282,72,4.6
Women Clothing,Cutting Sheet Apron Hairdressing Gown Cape Hair Cutting Barber Cloth Salon Accessories Pack of 3,312,55,2.7
Women Clothing,Mercel Brown Polyester Women's Nightwear Night Dress ( Pack of 1 ),215,85,3.9
Women Clothing,PuriMaa Maroon Organza Circular Semi Stitched Lehenga,765,74,4.6
Women Clothing,ZWERLON GREY Crepe Women's A-Line Skirt ( Pack of 1 ),360,82,4.6
Women Clothing,Kiran Enterprises Pack of 3 Cotton Non Padded Everyday Bra For Women ( Multicolor ),205,71,4.2
